{
  "$schema": "https://json-schema.org/draft/2020-12/schema",
  "title": "Replay spec v1",
  "type": "object",
  "required": ["cc_id", "cc_name", "version", "recorded_at", "probe", "steps", "extract"],
  "additionalProperties": false,
  "properties": {
    "cc_id": {"type": "integer", "minimum": 1},
    "cc_name": {"type": "string", "minLength": 1},
    "version": {"const": 1},
    "recorded_at": {"type": "string", "pattern": "^\\d{4}-\\d{2}-\\d{2}$"},
    "notes": {"type": "string"},
    "probe": {
      "type": "object",
      "required": ["course_code", "term"],
      "additionalProperties": false,
      "properties": {
        "course_code": {"type": "string", "minLength": 1},
        "term": {"type": "string", "pattern": "^(Spring|Summer|Fall) \\d{4}$"},
        "expect_min_rows": {"type": "integer", "minimum": 0}
      }
    },
    "inputs": {
      "type": "object",
      "additionalProperties": false,
      "properties": {
        "term": {
          "type": "object",
          "required": ["format", "seasons"],
          "additionalProperties": false,
          "properties": {
            "format": {"type": "string", "minLength": 1},
            "seasons": {"$ref": "#/$defs/stringMap"}
          }
        },
        "named": {
          "type": "object",
          "propertyNames": {"pattern": "^[a-z][a-z0-9_]*$"},
          "additionalProperties": {
            "type": "object",
            "required": ["from"],
            "additionalProperties": false,
            "properties": {
              "from": {"enum": ["course_code", "subject", "number"]},
              "transform": {"enum": ["as_is", "upper", "dash_join", "compact"]}
            }
          }
        }
      }
    },
    "steps": {"type": "array", "minItems": 1, "maxItems": 5, "items": {"$ref": "#/$defs/step"}},
    "extract": {"$ref": "#/$defs/extract"}
  },
  "$defs": {
    "stringMap": {"type": "object", "additionalProperties": {"type": "string"}},
    "valueRule": {
      "oneOf": [
        {"type": "string", "minLength": 1},
        {
          "type": "object",
          "additionalProperties": false,
          "properties": {
            "path": {"type": "string", "minLength": 1},
            "css": {"type": "string", "minLength": 1},
            "attr": {"type": "string", "minLength": 1},
            "regex": {"type": "string", "minLength": 1},
            "const": {"type": "string"},
            "join": {"type": "array", "minItems": 1, "items": {"$ref": "#/$defs/valueRule"}},
            "sep": {"type": "string"}
          }
        }
      ]
    },
    "capture": {
      "type": "object",
      "additionalProperties": false,
      "properties": {
        "cookie": {"type": "string", "minLength": 1},
        "regex": {"type": "string", "minLength": 1},
        "json": {"type": "string", "minLength": 1},
        "css": {"type": "string", "minLength": 1},
        "attr": {"type": "string", "minLength": 1},
        "lookup": {
          "type": "object",
          "required": ["rows", "label", "value"],
          "additionalProperties": false,
          "properties": {
            "rows": {"type": "string", "minLength": 1},
            "label": {"type": "string", "minLength": 1},
            "value": {"type": "string", "minLength": 1}
          }
        },
        "on_missing": {"enum": ["portal_changed", "term_not_listed"]}
      },
      "oneOf": [
        {"required": ["cookie"]},
        {"required": ["regex"]},
        {"required": ["json"]},
        {"required": ["css"]},
        {"required": ["lookup"]}
      ]
    },
    "paginate": {
      "type": "object",
      "required": ["param", "page_size", "total_capture"],
      "additionalProperties": false,
      "properties": {
        "param": {"type": "string", "minLength": 1},
        "first": {"type": "integer", "minimum": 0},
        "increment": {"type": "integer", "minimum": 1},
        "page_size": {"type": "integer", "minimum": 1},
        "max_pages": {"type": "integer", "minimum": 1, "maximum": 50},
        "total_capture": {"type": "string", "minLength": 1}
      }
    },
    "step": {
      "type": "object",
      "required": ["id", "method", "url"],
      "additionalProperties": false,
      "properties": {
        "id": {"type": "string", "pattern": "^[a-z][a-z0-9_]*$"},
        "method": {"enum": ["GET", "POST"]},
        "url": {"type": "string", "pattern": "^https://"},
        "query": {"$ref": "#/$defs/stringMap"},
        "form": {"$ref": "#/$defs/stringMap"},
        "json": {"type": "object"},
        "headers": {"$ref": "#/$defs/stringMap"},
        "captures": {
          "type": "object",
          "propertyNames": {"pattern": "^[a-z][a-z0-9_]*$"},
          "additionalProperties": {"$ref": "#/$defs/capture"}
        },
        "cache": {"type": "boolean"},
        "paginate": {"$ref": "#/$defs/paginate"}
      }
    },
    "filterRule": {
      "type": "object",
      "required": ["value"],
      "additionalProperties": false,
      "properties": {
        "value": {"$ref": "#/$defs/valueRule"},
        "equals": {"type": "string"},
        "any_of": {"type": "array", "minItems": 1, "items": {"type": "string"}}
      },
      "oneOf": [{"required": ["equals"]}, {"required": ["any_of"]}]
    },
    "meetingRule": {
      "type": "object",
      "additionalProperties": false,
      "properties": {
        "each": {"type": "string", "minLength": 1},
        "days": {
          "type": "object",
          "additionalProperties": false,
          "properties": {
            "flags": {"type": "array", "minItems": 7, "maxItems": 7, "items": {"$ref": "#/$defs/valueRule"}},
            "text": {"$ref": "#/$defs/valueRule"}
          },
          "oneOf": [{"required": ["flags"]}, {"required": ["text"]}]
        },
        "time_text": {"$ref": "#/$defs/valueRule"},
        "time_pattern": {"type": "string", "minLength": 1},
        "start": {"$ref": "#/$defs/valueRule"},
        "end": {"$ref": "#/$defs/valueRule"},
        "location": {"$ref": "#/$defs/valueRule"},
        "start_date": {"$ref": "#/$defs/valueRule"},
        "end_date": {"$ref": "#/$defs/valueRule"}
      }
    },
    "extract": {
      "type": "object",
      "required": ["kind", "rows", "fields"],
      "additionalProperties": false,
      "properties": {
        "kind": {"enum": ["json", "html"]},
        "rows": {"type": "string", "minLength": 1},
        "marker": {"type": "string", "minLength": 1},
        "filter": {"type": "array", "items": {"$ref": "#/$defs/filterRule"}},
        "fields": {
          "type": "object",
          "required": ["section_id"],
          "additionalProperties": false,
          "properties": {
            "section_id": {"$ref": "#/$defs/valueRule"},
            "title": {"$ref": "#/$defs/valueRule"},
            "instructor": {"$ref": "#/$defs/valueRule"},
            "seats_total": {"$ref": "#/$defs/valueRule"},
            "seats_used": {"$ref": "#/$defs/valueRule"},
            "seats_available": {"$ref": "#/$defs/valueRule"},
            "wait_capacity": {"$ref": "#/$defs/valueRule"},
            "course_code_as_listed": {"$ref": "#/$defs/valueRule"}
          }
        },
        "status": {
          "oneOf": [
            {"$ref": "#/$defs/valueRule"},
            {"type": "object", "required": ["from_seats"], "additionalProperties": false,
             "properties": {"from_seats": {"const": true}}}
          ]
        },
        "modality": {
          "type": "object",
          "additionalProperties": false,
          "properties": {
            "tokens": {"type": "array", "minItems": 1, "items": {"$ref": "#/$defs/valueRule"}},
            "map": {"$ref": "#/$defs/stringMap"}
          }
        },
        "meetings": {"type": "array", "items": {"$ref": "#/$defs/meetingRule"}}
      }
    }
  }
}
